{
  "incident_time": "2026-04-21T14:59:28.593074+00:00",
  "feature_flag": "loadGeneratorFloodHomepage",
  "description": "A feature flag in the load generator's `locustfile.py` activated a `flood_home` Locust task (weighted 5/32, ~16% of selection per cycle) that fired `flood_count = 100` rapid GETs to the frontend homepage; outbound HTTP request rate from the load generator spiked, driving container CPU and network traffic on the frontend and frontend-proxy containers above baseline.",
  "mechanism": "The flag is read in [`locustfile.py#L220`](../../opentelemetry-demo/src/load-generator/locustfile.py#L220), inside the load generator's Locust test suite.\n\nEach simulated user repeats this loop:\n\n1. Execute one randomly-chosen task (weighted)\n2. Wait for `wait_time` (1–10 seconds, [line 114](../../opentelemetry-demo/src/load-generator/locustfile.py#L114))\n3. Go back to step 1\n\nOne iteration of that loop is a \"cycle.\" Each user runs independently and concurrently. There are **5 simulated users** (see [`.env#L101`](../../opentelemetry-demo/.env#L101)).\n\n`flood_home` has a **5/32 (~16%) chance** of being selected each cycle. When selected, it sends `flood_count` rapid requests to the homepage. The `flood_count` value is **100**, defined in [`demo.flagd.json#L105`](../../opentelemetry-demo/src/flagd/demo.flagd.json#L105).",
  "symptoms": {
    "metrics": [
      {
        "metric_family": "container_network_io_usage_rx_bytes",
        "signal_layer": "root_cause",
        "defining_labels": {
          "container_name": "load-generator"
        },
        "variants": [
          {
            "type": "spiked",
            "query": "rate(container_network_io_usage_rx_bytes_total{container_name=\"load-generator\"}[5m])",
            "description": "Network bytes received by the load-generator container increased ~1.5-2.5x (from ~28,500 B/s to 46,000-71,000 B/s) as it ingested homepage responses from the 100-request flood bursts",
            "onset_utc": "2026-04-21 15:00:00 UTC",
            "onset_offset_seconds": 31,
            "onset_reasoning": "Pre-incident baseline is ~28,200-28,750. At 15:00 the value jumps to 29,750, exceeding the baseline maximum by ~1,000, and continues rising sharply to 35,104 at 15:01 and beyond. 15:00 is the first clear departure above baseline."
          }
        ]
      },
      {
        "metric_family": "container_network_io_usage_tx_bytes",
        "signal_layer": "root_cause",
        "defining_labels": {
          "container_name": "load-generator"
        },
        "variants": [
          {
            "type": "spiked",
            "query": "rate(container_network_io_usage_tx_bytes_total{container_name=\"load-generator\"}[5m])",
            "description": "Network bytes transmitted by the load-generator container increased ~1.2-1.5x (from ~12,800 B/s to 15,500-19,000 B/s) as it sent the flood of homepage GET requests to frontend-proxy",
            "onset_utc": "2026-04-21 15:01:00 UTC",
            "onset_offset_seconds": 91,
            "onset_reasoning": "Pre-incident baseline hovers around 12,700-13,075. At 15:01 the value jumps to 13,853, clearly breaking above the baseline ceiling, and continues rising sharply to 16,000+ in subsequent minutes."
          }
        ]
      },
      {
        "metric_family": "container_network_io_usage_rx_bytes",
        "signal_layer": "propagation",
        "defining_labels": {
          "container_name": "frontend-proxy"
        },
        "variants": [
          {
            "type": "spiked",
            "query": "rate(container_network_io_usage_rx_bytes_total{container_name=\"frontend-proxy\"}[5m])",
            "description": "Network bytes received by the frontend-proxy container surged ~25-50x (from ~900 B/s to 21,000-49,000 B/s) because the load generator's flood_home task sent 100 rapid homepage GET requests per invocation through the Envoy proxy",
            "onset_utc": "2026-04-21 15:00:00 UTC",
            "onset_offset_seconds": 31,
            "onset_reasoning": "Pre-incident baseline fluctuates roughly 760-1060 bytes/s. At 15:00 UTC (one minute after the incident marker), the value jumps to ~2472, already well above the baseline range, and continues climbing rapidly to ~30k+. This is the first clear departure from the baseline."
          }
        ]
      },
      {
        "metric_family": "container_network_io_usage_rx_bytes",
        "signal_layer": "symptom",
        "defining_labels": {
          "container_name": "frontend"
        },
        "variants": [
          {
            "type": "spiked",
            "query": "rate(container_network_io_usage_rx_bytes_total{container_name=\"frontend\"}[5m])",
            "description": "Network bytes received by the frontend container increased ~4-5x (from ~700 B/s to 3,000-5,700 B/s) as the frontend-proxy forwarded the flood of homepage requests to the Next.js frontend",
            "onset_utc": "2026-04-21 15:00:00 UTC",
            "onset_offset_seconds": 31,
            "onset_reasoning": "Pre-incident baseline fluctuates roughly 550-880 bytes/s. At 15:00 (one minute after incident at 14:59:28), the value jumps to 870 and then rapidly escalates to 1583, 2419, 3350+ in subsequent minutes, never returning to baseline. 15:00 marks the start of this sustained exponential rise."
          }
        ]
      },
      {
        "metric_family": "jaeger_storage_bulk_index_attempts",
        "signal_layer": "meta",
        "defining_labels": {},
        "variants": [
          {
            "type": "spiked",
            "query": "sum(rate(jaeger_storage_bulk_index_attempts_total[5m]))",
            "description": "Jaeger bulk index attempts tripled as the storage layer processed more batches of spans from the flood-induced traffic surge",
            "onset_utc": "2026-04-21 15:01:00 UTC",
            "onset_offset_seconds": 91,
            "onset_reasoning": "Pre-incident baseline fluctuates roughly between 6-20. At 15:00 the value (14.29) is still within normal range. At 15:01 it jumps to 27.63, clearly exceeding the pre-incident maximum of ~20.8, marking the start of the sustained spike to 50-67 levels."
          }
        ]
      }
    ],
    "logs": [
      {
        "name": "load-generator: User flooding homepage 100 times (INFO)",
        "description": "Starting at 14:59:41.379 UTC and continuing through 15:09:28.578 UTC, load-generator emitted 34 flood_home logs confirming loadGeneratorFloodHomepage is ON with value 100. The downstream effect is visible in frontend-proxy Envoy access logs as a surge in homepage GETs starting at 14:59 UTC (baseline ~1-3 req/min through 14:58, climbing to 100-561 req/min during 14:59-15:09), all returning HTTP 200.",
        "cause": "Direct effect of the loadGeneratorFloodHomepage feature flag. When flagd returns a value > 0, locust's flood_home task starts a user_flood_home span (attribute flood.count=100) and logs 'User flooding homepage {flood_count} times' before issuing that many GET / requests against frontend-proxy.",
        "source": "load-generator (Locust, opentelemetry-demo/src/load-generator/locustfile.py:219-225)",
        "representative_attributes": {
          "body": "User flooding homepage 100 times",
          "severity.text": "INFO",
          "resource.service.name": "load-generator",
          "instrumentationScope.name": "root",
          "code.file.path": "/usr/src/app/locustfile.py",
          "code.function.name": "flood_home",
          "code.line.number": "223",
          "traceId": "450cbb92d45db5145f52cadf7f0efd23",
          "spanId": "1e43ecaba40b4994"
        },
        "log_documents": [
          {
            "_index": "otel-logs-2026-04-21",
            "_id": "s6uNsJ0Br_RFnSwR4PHy",
            "@timestamp": "14:59:41.379"
          }
        ]
      }
    ],
    "frontend": [],
    "traces": []
  }
}
